{
	"owner": "bob",
        "owner-myngl-security": "1" ,
	"dataset": "Bank of America - 3/31/18",
        "dataset-myngl-security": "1",
	"name": "Jane Dpe",
        "name-myngl-security": "9",
	"state": "CA",
        "state-myngl-security": "5",
	"city": "San Francisco",
        "city-myngl-security": "5",
	"zipcode": "94102",
        "zipcode-myngl-security": "5",
	"email": "jane.doe2014@gmail.com",
        "email-myngl-security": "7",
	"birthday": "1998-1-31",
        "birthday-myngl-security": "9",
	"cardnumber": "1111-0000-0000-0000",
        "cardnumber-myngl-security": "9",
	"ssn": "111-000-0000",
        "ssn-myngl-security": "9",
	"creditscore": "750",
        "creditscore-myngl-security": "8"
}
